{
  "schemaVersion": 2,
  "id": "v2-image-sdxl-thumbnail-detail",
  "content": {
    "title": "Stable Diffusion / SDXL · 视频缩略图 · 详情页版",
    "summary": "Stable Diffusion / SDXL 适用的「视频缩略图」详情页版：生成短视频或课程缩略图，强调一眼可懂的冲突和标题区，包含复制即用正文、可替换关键词、平台参数、失败修正和安全边界。",
    "preview": "",
    "prompt": "请使用 Stable Diffusion / SDXL 生成一张「视频缩略图」图片。画面主体是 {视频主题}，使用场景为 {标题}，重点呈现 {人物表情}，整体风格、情绪和色彩氛围为 {场景}，采用 {画面比例} 构图。增加材质、纹理、边缘和功能细节，适合商品详情和案例页。 构图需要有清晰视觉中心、前中后景层次、可见材质细节、可控光影和后期排版留白。文字只允许出现用户明确填写的短句，其他区域保持无文字。输出必须商业安全、原创、可直接用于图片生成。",
    "copyPrompt": "",
    "language": "zh-CN"
  },
  "classification": {
    "category": "图像提示词 / Stable Diffusion",
    "department": "AI 视觉设计",
    "scenario": "Stable Diffusion",
    "task": "视频缩略图",
    "modality": "图像",
    "useCase": "视频缩略图",
    "aspectRatio": "{画面比例}",
    "difficulty": "入门",
    "tags": [
      "工具:Stable Diffusion / SDXL",
      "模态:图像",
      "用途:视频缩略图",
      "难度:入门",
      "官方结构参考:否",
      "一键复制模板",
      "可替换关键词",
      "图片视频生成",
      "sdxl",
      "thumbnail"
    ],
    "styleTags": [],
    "seoKeywords": [
      "图像",
      "Stable Diffusion / SDXL",
      "视频缩略图",
      "图像提示词",
      "Stable",
      "Diffusion",
      "工具:Stable Diffusion / SDXL",
      "模态:图像",
      "用途:视频缩略图",
      "难度:入门"
    ]
  },
  "model": {
    "tool": "Stable Diffusion / SDXL",
    "name": "sdxl"
  },
  "variables": {
    "names": [
      "{视频主题}",
      "{标题}",
      "{人物表情}",
      "{场景}",
      "{平台}",
      "{画面比例}",
      "{冲突点}",
      "{色彩}",
      "{目标平台}",
      "{输出格式}"
    ],
    "defaults": {
      "视频主题": "待定",
      "标题": "待定",
      "人物表情": "待定",
      "场景": "自然光工作台",
      "平台": "待定",
      "画面比例": "4:5",
      "冲突点": "待定",
      "色彩": "待定",
      "目标平台": "待定",
      "输出格式": "待定"
    }
  },
  "provenance": {
    "source": "v2 5000 visual copy-ready templates / original platform-adapted library",
    "authorName": "",
    "authorUrl": "",
    "sourceUrl": "",
    "licenseType": "",
    "licenseConfirmed": false,
    "submissionIssueNumber": null,
    "rightsStatus": "pending"
  },
  "proof": null,
  "publication": {
    "status": "published",
    "featured": false,
    "copyReady": true,
    "qualityScore": 100,
    "qualityLevel": "quality-v2-passed",
    "verifiedAt": "2026-05-21",
    "collectionIds": [],
    "createdAt": "",
    "updatedAt": "",
    "publishedAt": "",
    "qualityAssessment": {
      "status": "passed",
      "rubricVersion": "prompt-quality-v2",
      "score": 100,
      "checkedAt": "2026-07-12",
      "issues": []
    }
  }
}
