{
  "schemaVersion": 2,
  "id": "v2-image-firefly-data-dashboard-social",
  "content": {
    "title": "Adobe Firefly · 数据看板宣传图 · 社媒封面版",
    "summary": "Adobe Firefly 适用的「数据看板宣传图」社媒封面版：生成虚构数据看板界面，用于产品介绍或汇报，包含复制即用正文、可替换关键词、平台参数、失败修正和安全边界。",
    "preview": "",
    "prompt": "请使用 Adobe Firefly 生成一张「数据看板宣传图」图片。画面主体是 {业务场景}，使用场景为 {指标}，重点呈现 {界面风格}，整体风格、情绪和色彩氛围为 {重点模块}，采用 {画面比例} 构图。保留标题区和安全边距，适合小红书、抖音、视频封面和轮播首图。 构图需要有清晰视觉中心、前中后景层次、可见材质细节、可控光影和后期排版留白。文字只允许出现用户明确填写的短句，其他区域保持无文字。输出必须商业安全、原创、可直接用于图片生成。",
    "copyPrompt": "",
    "language": "zh-CN"
  },
  "classification": {
    "category": "图像提示词 / Adobe Firefly",
    "department": "AI 视觉设计",
    "scenario": "Adobe Firefly",
    "task": "数据看板宣传图",
    "modality": "图像",
    "useCase": "数据看板宣传图",
    "aspectRatio": "{画面比例}",
    "difficulty": "进阶",
    "tags": [
      "工具:Adobe Firefly",
      "模态:图像",
      "用途:数据看板宣传图",
      "难度:进阶",
      "官方结构参考:否",
      "一键复制模板",
      "可替换关键词",
      "图片视频生成",
      "firefly",
      "data-dashboard"
    ],
    "styleTags": [],
    "seoKeywords": [
      "图像",
      "Adobe Firefly",
      "数据看板宣传图",
      "图像提示词",
      "Adobe",
      "Firefly",
      "工具:Adobe Firefly",
      "模态:图像",
      "用途:数据看板宣传图",
      "难度:进阶"
    ]
  },
  "model": {
    "tool": "Adobe Firefly",
    "name": "firefly"
  },
  "variables": {
    "names": [
      "{业务场景}",
      "{指标}",
      "{界面风格}",
      "{重点模块}",
      "{画面比例}",
      "{设备}",
      "{图表类型}",
      "{色彩}",
      "{目标平台}",
      "{输出格式}"
    ],
    "defaults": {
      "业务场景": "待定",
      "指标": "待定",
      "界面风格": "待定",
      "重点模块": "待定",
      "画面比例": "4:5",
      "设备": "待定",
      "图表类型": "待定",
      "色彩": "待定",
      "目标平台": "待定",
      "输出格式": "待定"
    }
  },
  "provenance": {
    "source": "v2 5000 visual copy-ready templates / original platform-adapted library",
    "authorName": "",
    "authorUrl": "",
    "sourceUrl": "",
    "licenseType": "",
    "licenseConfirmed": false,
    "submissionIssueNumber": null,
    "rightsStatus": "pending"
  },
  "proof": null,
  "publication": {
    "status": "published",
    "featured": false,
    "copyReady": true,
    "qualityScore": 90,
    "qualityLevel": "quality-v3-ready",
    "verifiedAt": "2026-05-21",
    "collectionIds": [],
    "createdAt": "",
    "updatedAt": "",
    "publishedAt": "",
    "qualityAssessment": {
      "status": "passed",
      "rubricVersion": "prompt-quality-v3-structural",
      "score": 90,
      "checkedAt": "2026-07-18",
      "issues": []
    }
  }
}
