{
  "schemaVersion": 2,
  "id": "v2-video-kling-hotel-room-storyboard",
  "content": {
    "title": "可灵 Kling · 酒店空间短片 · 分镜版",
    "summary": "可灵 Kling 适用的「酒店空间短片」分镜版：展示客房、灯光、窗景和服务氛围，包含复制即用正文、可替换关键词、平台参数、失败修正和安全边界。",
    "preview": "",
    "prompt": "请使用 可灵 Kling 生成一段「酒店空间短片」视频。主体是 {酒店类型}，发生在 {空间}，核心动作围绕 {镜头路径} 展开，镜头使用 {光线} 或同等稳定运镜，画幅为 {比例}。拆成 3 到 5 个镜头，每个镜头只承担一个动作目标。 前 3 秒交代主体和目标，中段展示动作变化，结尾停在可作为封面的稳定画面。保持主体、服装、道具、产品外观、光线和空间方向一致；不要突然切换场景、不要身份漂移、不要生成随机文字。",
    "copyPrompt": "",
    "language": "zh-CN"
  },
  "classification": {
    "category": "视频提示词 / 可灵",
    "department": "AI 视频创作",
    "scenario": "可灵",
    "task": "酒店空间短片",
    "modality": "视频",
    "useCase": "酒店空间短片",
    "aspectRatio": "{画面比例}",
    "difficulty": "中级",
    "tags": [
      "工具:可灵 Kling",
      "模态:视频",
      "用途:酒店空间短片",
      "难度:中级",
      "官方结构参考:否",
      "一键复制模板",
      "可替换关键词",
      "图片视频生成",
      "kling",
      "hotel-room"
    ],
    "styleTags": [],
    "seoKeywords": [
      "视频",
      "可灵 Kling",
      "酒店空间短片",
      "视频提示词",
      "可灵",
      "工具:可灵 Kling",
      "模态:视频",
      "用途:酒店空间短片",
      "难度:中级",
      "官方结构参考:否"
    ]
  },
  "model": {
    "tool": "可灵 Kling",
    "name": "kling"
  },
  "variables": {
    "names": [
      "{酒店类型}",
      "{空间}",
      "{镜头路径}",
      "{光线}",
      "{客群}",
      "{比例}",
      "{时长}",
      "{收尾}",
      "{输出格式}"
    ],
    "defaults": {
      "酒店类型": "待定",
      "空间": "待定",
      "镜头路径": "待定",
      "光线": "暖色桌面灯与冷色环境对比",
      "客群": "待定",
      "比例": "9:16",
      "时长": "8 秒",
      "收尾": "待定",
      "输出格式": "待定"
    }
  },
  "provenance": {
    "source": "v2 5000 visual copy-ready templates / original platform-adapted library",
    "authorName": "",
    "authorUrl": "",
    "sourceUrl": "",
    "licenseType": "",
    "licenseConfirmed": false,
    "submissionIssueNumber": null,
    "rightsStatus": "pending"
  },
  "proof": null,
  "publication": {
    "status": "published",
    "featured": false,
    "copyReady": true,
    "qualityScore": 100,
    "qualityLevel": "quality-v2-passed",
    "verifiedAt": "2026-05-21",
    "collectionIds": [],
    "createdAt": "",
    "updatedAt": "",
    "publishedAt": "",
    "qualityAssessment": {
      "status": "passed",
      "rubricVersion": "prompt-quality-v2",
      "score": 100,
      "checkedAt": "2026-07-12",
      "issues": []
    }
  }
}
