{
  "schemaVersion": 2,
  "id": "v2-video-pika-interior-tour-three-act",
  "content": {
    "title": "Pika · 室内空间漫游 · 三段式版",
    "summary": "Pika 适用的「室内空间漫游」三段式版：从入口到核心区域的连续空间展示，包含复制即用正文、可替换关键词、平台参数、失败修正和安全边界。",
    "preview": "",
    "prompt": "请使用 Pika 生成一段「室内空间漫游」视频。主体是 {空间类型}，发生在 {风格}，核心动作围绕 {动线} 展开，镜头使用 {镜头高度} 或同等稳定运镜，画幅为 {画面比例}。开头交代问题，中段展示变化，结尾形成可截图的稳定画面。 前 3 秒交代主体和目标，中段展示动作变化，结尾停在可作为封面的稳定画面。保持主体、服装、道具、产品外观、光线和空间方向一致；不要突然切换场景、不要身份漂移、不要生成随机文字。",
    "copyPrompt": "",
    "language": "zh-CN"
  },
  "classification": {
    "category": "视频提示词 / Pika",
    "department": "AI 视频创作",
    "scenario": "Pika",
    "task": "室内空间漫游",
    "modality": "视频",
    "useCase": "室内空间漫游",
    "aspectRatio": "{画面比例}",
    "difficulty": "进阶",
    "tags": [
      "工具:Pika",
      "模态:视频",
      "用途:室内空间漫游",
      "难度:进阶",
      "官方结构参考:否",
      "一键复制模板",
      "可替换关键词",
      "图片视频生成",
      "pika",
      "interior-tour"
    ],
    "styleTags": [],
    "seoKeywords": [
      "视频",
      "Pika",
      "室内空间漫游",
      "视频提示词",
      "工具:Pika",
      "模态:视频",
      "用途:室内空间漫游",
      "难度:进阶",
      "官方结构参考:否",
      "一键复制模板"
    ]
  },
  "model": {
    "tool": "Pika",
    "name": "pika"
  },
  "variables": {
    "names": [
      "{空间类型}",
      "{风格}",
      "{动线}",
      "{镜头高度}",
      "{光线}",
      "{画面比例}",
      "{家具}",
      "{结尾}",
      "{时长}",
      "{输出格式}"
    ],
    "defaults": {
      "空间类型": "待定",
      "风格": "待定",
      "动线": "待定",
      "镜头高度": "待定",
      "光线": "暖色桌面灯与冷色环境对比",
      "画面比例": "9:16",
      "家具": "待定",
      "结尾": "待定",
      "时长": "8 秒",
      "输出格式": "待定"
    }
  },
  "provenance": {
    "source": "v2 5000 visual copy-ready templates / original platform-adapted library",
    "authorName": "",
    "authorUrl": "",
    "sourceUrl": "",
    "licenseType": "",
    "licenseConfirmed": false,
    "submissionIssueNumber": null,
    "rightsStatus": "pending"
  },
  "proof": null,
  "publication": {
    "status": "published",
    "featured": false,
    "copyReady": true,
    "qualityScore": 90,
    "qualityLevel": "quality-v3-ready",
    "verifiedAt": "2026-05-21",
    "collectionIds": [],
    "createdAt": "",
    "updatedAt": "",
    "publishedAt": "",
    "qualityAssessment": {
      "status": "passed",
      "rubricVersion": "prompt-quality-v3-structural",
      "score": 90,
      "checkedAt": "2026-07-18",
      "issues": []
    }
  }
}
