{
  "schemaVersion": 2,
  "id": "cinematic-single-person-image-025",
  "content": {
    "title": "影视导演工作台 · 孤独车站人物",
    "summary": "孤独车站人物模板，覆盖主体、场景、镜头、光影、色彩、情绪、画幅和负面约束，可复制中文、英文、Midjourney、视频版和负面词。",
    "preview": "",
    "prompt": "孤独车站人物，请生成一张可直接用于商业安全创作的电影感图像。主体为原创机甲骑手，位于赛博城市街头，穿着或携带银色轻型机甲与黑色头盔，动作和表情保持克制但有明确戏剧动机。使用半身近景，背影，广角低角度，构图有清晰视觉中心和前中后景层次。光影为逆光，色彩为复古港风，情绪是告别，整体风格为赛博霓虹电影感。背景只服务主体，不堆砌无关装饰；皮肤、布料、金属、雨水或玻璃反光要真实；眼神清晰，手部自然，身份稳定。输出为 3:4，画面不要文字、不要水印、不要可识别品牌标识、不要真人肖像冒用。质量标准：主体完整、景别准确、光线统一、色彩可控、情绪明确、可直接复制到图像模型使用。",
    "copyPrompt": "",
    "language": "bilingual"
  },
  "classification": {
    "category": "影视提示词 / 单人图片",
    "department": "影视创作",
    "scenario": "单人图片",
    "task": "电影感单人肖像",
    "modality": "图像",
    "useCase": "电影感单人肖像",
    "aspectRatio": "3:4",
    "difficulty": "进阶",
    "tags": [
      "工具:Runway",
      "模态:图像",
      "用途:电影感单人肖像",
      "难度:进阶",
      "影视提示词",
      "电影感",
      "变量替换",
      "一键复制",
      "single-person-image"
    ],
    "styleTags": [
      "赛博霓虹电影感",
      "电影感单人肖像",
      "孤独车站人物"
    ],
    "seoKeywords": [
      "图像",
      "Runway",
      "电影感单人肖像",
      "影视提示词",
      "单人图片",
      "工具:Runway",
      "模态:图像",
      "用途:电影感单人肖像",
      "难度:进阶",
      "电影感"
    ]
  },
  "model": {
    "tool": "Runway",
    "name": "runway"
  },
  "variables": {
    "names": [
      "{subject}",
      "{scene}",
      "{mood}",
      "{clothing}",
      "{lighting}",
      "{camera}",
      "{aspectRatio}",
      "{style}"
    ],
    "defaults": {
      "subject": "原创机甲骑手",
      "scene": "赛博城市街头",
      "mood": "速度感、孤勇、危险",
      "clothing": "银色轻型机甲与黑色头盔",
      "lighting": "霓虹逆光、雨夜反光、体积光",
      "camera": "广角低角度",
      "style": "赛博霓虹电影感",
      "aspectRatio": "3:4"
    }
  },
  "provenance": {
    "source": "原创影视提示词导演工作台 / 官方结构参考",
    "authorName": "",
    "authorUrl": "",
    "sourceUrl": "",
    "licenseType": "",
    "licenseConfirmed": false,
    "submissionIssueNumber": null,
    "rightsStatus": "pending"
  },
  "proof": {
    "status": "preview",
    "modality": "image",
    "provider": "openai",
    "model": "ChatGPT web / GPT Image",
    "testedAt": "2026-05-24T11:38:15.595Z",
    "resultNote": "Legacy cover remains an effect preview and requires a new modality-matched run.",
    "evidenceLevel": "generated-preview",
    "assets": [
      {
        "role": "cover",
        "storage": "repository",
        "key": "proofs/generated/cinematic-single-person-image-025.webp",
        "url": "/prompts/proofs/generated/cinematic-single-person-image-025.webp",
        "mimeType": "image/webp",
        "sha256": "853f8a4f3cc82818f2d92189cb34c89f0054180835e2dbd2f53182927155783d",
        "bytes": 108404,
        "width": 1200,
        "height": 900,
        "durationMs": null
      }
    ],
    "run": {
      "runId": "legacy-cinematic-single-person-image-025",
      "inputSha256": "",
      "outputSha256": "853f8a4f3cc82818f2d92189cb34c89f0054180835e2dbd2f53182927155783d",
      "parameters": {
        "source": "Codex browser automation",
        "sourceInputReference": "",
        "inputRecovery": "missing",
        "outputRole": "preview-cover"
      },
      "attempt": 1
    },
    "qa": {
      "automatedStatus": "failed",
      "humanStatus": "not-reviewed",
      "checks": [
        "webp-decodable",
        "output-sha256-recorded",
        "original-input-missing",
        "asset-rights-confirmed",
        "modality-output-matched"
      ],
      "reviewedAt": "",
      "failureReason": "missing-original-input"
    },
    "rights": {
      "status": "confirmed",
      "basis": "repository-owner-confirmed",
      "confirmedAt": "2026-07-17",
      "note": "The repository owner confirmed rights to use the legacy preview asset."
    }
  },
  "publication": {
    "status": "published-proofed",
    "featured": true,
    "copyReady": true,
    "qualityScore": 88,
    "qualityLevel": "quality-v3-review",
    "verifiedAt": "2026-05-21",
    "collectionIds": [],
    "createdAt": "",
    "updatedAt": "",
    "publishedAt": "",
    "qualityAssessment": {
      "status": "passed",
      "rubricVersion": "prompt-quality-v3-structural",
      "score": 88,
      "checkedAt": "2026-07-18",
      "issues": []
    }
  }
}
