{
  "schemaVersion": 2,
  "id": "v2-video-sora-macro-motion-image-to-video",
  "content": {
    "title": "Sora · 微距动态镜头 · 图生视频版",
    "summary": "Sora 适用的「微距动态镜头」图生视频版：用微距展示材质、液体、颗粒或机械细节，包含复制即用正文、可替换关键词、平台参数、失败修正和安全边界。",
    "preview": "",
    "prompt": "请使用 Sora 生成一段「微距动态镜头」视频。主体是 {主体}，发生在 {材质}，核心动作围绕 {动作} 展开，镜头使用 {镜头} 或同等稳定运镜，画幅为 {比例}。把首帧作为构图和主体依据，只描述运动和环境变化。 前 3 秒交代主体和目标，中段展示动作变化，结尾停在可作为封面的稳定画面。保持主体、服装、道具、产品外观、光线和空间方向一致；不要突然切换场景、不要身份漂移、不要生成随机文字。",
    "copyPrompt": "",
    "language": "zh-CN"
  },
  "classification": {
    "category": "视频提示词 / Sora",
    "department": "AI 视频创作",
    "scenario": "Sora",
    "task": "微距动态镜头",
    "modality": "视频",
    "useCase": "微距动态镜头",
    "aspectRatio": "{画面比例}",
    "difficulty": "中级",
    "tags": [
      "工具:Sora",
      "模态:视频",
      "用途:微距动态镜头",
      "难度:中级",
      "官方结构参考:否",
      "一键复制模板",
      "可替换关键词",
      "图片视频生成",
      "sora",
      "macro-motion"
    ],
    "styleTags": [],
    "seoKeywords": [
      "视频",
      "Sora",
      "微距动态镜头",
      "视频提示词",
      "工具:Sora",
      "模态:视频",
      "用途:微距动态镜头",
      "难度:中级",
      "官方结构参考:否",
      "一键复制模板"
    ]
  },
  "model": {
    "tool": "Sora",
    "name": "sora"
  },
  "variables": {
    "names": [
      "{主体}",
      "{材质}",
      "{动作}",
      "{镜头}",
      "{光线}",
      "{比例}",
      "{速度}",
      "{背景}",
      "{时长}",
      "{输出格式}"
    ],
    "defaults": {
      "主体": "原创成年角色与产品",
      "材质": "待定",
      "动作": "从关闭到点亮，再切到使用细节",
      "镜头": "缓慢推进",
      "光线": "暖色桌面灯与冷色环境对比",
      "比例": "9:16",
      "速度": "待定",
      "背景": "待定",
      "时长": "8 秒",
      "输出格式": "待定"
    }
  },
  "provenance": {
    "source": "v2 5000 visual copy-ready templates / original platform-adapted library",
    "authorName": "",
    "authorUrl": "",
    "sourceUrl": "",
    "licenseType": "",
    "licenseConfirmed": false,
    "submissionIssueNumber": null,
    "rightsStatus": "pending"
  },
  "proof": null,
  "publication": {
    "status": "published",
    "featured": false,
    "copyReady": true,
    "qualityScore": 100,
    "qualityLevel": "quality-v2-passed",
    "verifiedAt": "2026-05-21",
    "collectionIds": [],
    "createdAt": "",
    "updatedAt": "",
    "publishedAt": "",
    "qualityAssessment": {
      "status": "passed",
      "rubricVersion": "prompt-quality-v2",
      "score": 100,
      "checkedAt": "2026-07-12",
      "issues": []
    }
  }
}
