{
  "schemaVersion": 2,
  "id": "v2-image-dalle-app-store-visual-detail",
  "content": {
    "title": "DALL-E · 应用商店功能图 · 详情页版",
    "summary": "DALL-E 适用的「应用商店功能图」详情页版：为虚构应用生成应用商店截图风格图，清楚展示功能模块，包含复制即用正文、可替换关键词、平台参数、失败修正和安全边界。",
    "preview": "",
    "prompt": "请使用 DALL-E 生成一张「应用商店功能图」图片。画面主体是 {应用类型}，使用场景为 {核心功能}，重点呈现 {界面风格}，整体风格、情绪和色彩氛围为 {文案}，采用 {画面比例} 构图。增加材质、纹理、边缘和功能细节，适合商品详情和案例页。 构图需要有清晰视觉中心、前中后景层次、可见材质细节、可控光影和后期排版留白。文字只允许出现用户明确填写的短句，其他区域保持无文字。输出必须商业安全、原创、可直接用于图片生成。",
    "copyPrompt": "",
    "language": "zh-CN"
  },
  "classification": {
    "category": "图像提示词 / DALL-E",
    "department": "",
    "scenario": "",
    "task": "",
    "modality": "图像",
    "useCase": "应用商店功能图",
    "aspectRatio": "{画面比例}",
    "difficulty": "入门",
    "tags": [
      "工具:DALL-E",
      "模态:图像",
      "用途:应用商店功能图",
      "难度:入门",
      "官方结构参考:否",
      "一键复制模板",
      "可替换关键词",
      "图片视频生成",
      "dalle",
      "app-store-visual"
    ],
    "styleTags": [],
    "seoKeywords": [
      "图像",
      "DALL-E",
      "应用商店功能图",
      "图像提示词",
      "工具:DALL-E",
      "模态:图像",
      "用途:应用商店功能图",
      "难度:入门",
      "官方结构参考:否",
      "一键复制模板"
    ]
  },
  "model": {
    "tool": "DALL-E",
    "name": "dalle"
  },
  "variables": {
    "names": [
      "{应用类型}",
      "{核心功能}",
      "{界面风格}",
      "{文案}",
      "{设备框}",
      "{画面比例}",
      "{使用场景}",
      "{重点模块}",
      "{目标平台}",
      "{输出格式}"
    ],
    "defaults": {
      "应用类型": "待定",
      "核心功能": "待定",
      "界面风格": "待定",
      "文案": "待定",
      "设备框": "待定",
      "画面比例": "4:5",
      "使用场景": "清晨厨房台面",
      "重点模块": "待定",
      "目标平台": "待定",
      "输出格式": "待定"
    }
  },
  "provenance": {
    "source": "v2 5000 visual copy-ready templates / original platform-adapted library",
    "authorName": "",
    "authorUrl": "",
    "sourceUrl": "",
    "licenseType": "",
    "licenseConfirmed": false,
    "submissionIssueNumber": null,
    "rightsStatus": "pending"
  },
  "proof": null,
  "publication": {
    "status": "published",
    "featured": false,
    "copyReady": true,
    "qualityScore": 100,
    "qualityLevel": "quality-v2-passed",
    "verifiedAt": "2026-05-21",
    "collectionIds": [],
    "createdAt": "",
    "updatedAt": "",
    "publishedAt": "",
    "qualityAssessment": {
      "status": "passed",
      "rubricVersion": "prompt-quality-v2",
      "score": 100,
      "checkedAt": "2026-07-12",
      "issues": []
    }
  }
}
