{
  "schemaVersion": 2,
  "id": "v2-video-jimeng-seedance-shelf-display-three-act",
  "content": {
    "title": "即梦 / Seedance · 货架陈列短片 · 三段式版",
    "summary": "即梦 / Seedance 适用的「货架陈列短片」三段式版：展示商品在货架、展台或橱窗中的陈列，包含复制即用正文、可替换关键词、平台参数、失败修正和安全边界。",
    "preview": "",
    "prompt": "请使用 即梦 / Seedance 生成一段「货架陈列短片」视频。主体是 {商品系列}，发生在 {陈列环境}，核心动作围绕 {镜头} 展开，镜头使用 {光线} 或同等稳定运镜，画幅为 {比例}。开头交代问题，中段展示变化，结尾形成可截图的稳定画面。 前 3 秒交代主体和目标，中段展示动作变化，结尾停在可作为封面的稳定画面。保持主体、服装、道具、产品外观、光线和空间方向一致；不要突然切换场景、不要身份漂移、不要生成随机文字。",
    "copyPrompt": "",
    "language": "zh-CN"
  },
  "classification": {
    "category": "视频提示词 / 即梦 Seedance",
    "department": "",
    "scenario": "",
    "task": "",
    "modality": "视频",
    "useCase": "货架陈列短片",
    "aspectRatio": "{画面比例}",
    "difficulty": "中级",
    "tags": [
      "工具:即梦 / Seedance",
      "模态:视频",
      "用途:货架陈列短片",
      "难度:中级",
      "官方结构参考:否",
      "一键复制模板",
      "可替换关键词",
      "图片视频生成",
      "jimeng-seedance",
      "shelf-display"
    ],
    "styleTags": [],
    "seoKeywords": [
      "视频",
      "即梦 / Seedance",
      "货架陈列短片",
      "视频提示词",
      "即梦",
      "Seedance",
      "工具:即梦 / Seedance",
      "模态:视频",
      "用途:货架陈列短片",
      "难度:中级"
    ]
  },
  "model": {
    "tool": "即梦 / Seedance",
    "name": "jimeng-seedance"
  },
  "variables": {
    "names": [
      "{商品系列}",
      "{陈列环境}",
      "{镜头}",
      "{光线}",
      "{动作}",
      "{比例}",
      "{文字}",
      "{结尾}",
      "{时长}",
      "{输出格式}"
    ],
    "defaults": {
      "商品系列": "待定",
      "陈列环境": "待定",
      "镜头": "缓慢推进",
      "光线": "暖色桌面灯与冷色环境对比",
      "动作": "从关闭到点亮，再切到使用细节",
      "比例": "9:16",
      "文字": "待定",
      "结尾": "待定",
      "时长": "8 秒",
      "输出格式": "待定"
    }
  },
  "provenance": {
    "source": "v2 5000 visual copy-ready templates / original platform-adapted library",
    "authorName": "",
    "authorUrl": "",
    "sourceUrl": "",
    "licenseType": "",
    "licenseConfirmed": false,
    "submissionIssueNumber": null,
    "rightsStatus": "pending"
  },
  "proof": null,
  "publication": {
    "status": "published",
    "featured": false,
    "copyReady": true,
    "qualityScore": 100,
    "qualityLevel": "quality-v2-passed",
    "verifiedAt": "2026-05-21",
    "collectionIds": [],
    "createdAt": "",
    "updatedAt": "",
    "publishedAt": "",
    "qualityAssessment": {
      "status": "passed",
      "rubricVersion": "prompt-quality-v2",
      "score": 100,
      "checkedAt": "2026-07-12",
      "issues": []
    }
  }
}
