{
  "schemaVersion": 2,
  "id": "v2-video-kling-image-to-video-action-single-shot",
  "content": {
    "title": "可灵 Kling · 图片动作增强图生视频 · 单镜头版",
    "summary": "可灵 Kling 适用的「图片动作增强图生视频」单镜头版：在首帧基础上增加明确动作，但不改变主体身份，包含复制即用正文、可替换关键词、平台参数、失败修正和安全边界。",
    "preview": "",
    "prompt": "请使用 可灵 Kling 生成一段「图片动作增强图生视频」视频。主体是 {首帧内容}，发生在 {动作}，核心动作围绕 {幅度} 展开，镜头使用 {镜头} 或同等稳定运镜，画幅为 {比例}。一个连续镜头完成动作，减少跳帧和身份漂移。 前 3 秒交代主体和目标，中段展示动作变化，结尾停在可作为封面的稳定画面。保持主体、服装、道具、产品外观、光线和空间方向一致；不要突然切换场景、不要身份漂移、不要生成随机文字。",
    "copyPrompt": "",
    "language": "zh-CN"
  },
  "classification": {
    "category": "视频提示词 / 可灵",
    "department": "AI 视频创作",
    "scenario": "可灵",
    "task": "图片动作增强图生视频",
    "modality": "视频",
    "useCase": "图片动作增强图生视频",
    "aspectRatio": "{画面比例}",
    "difficulty": "入门",
    "tags": [
      "工具:可灵 Kling",
      "模态:视频",
      "用途:图片动作增强图生视频",
      "难度:入门",
      "官方结构参考:否",
      "一键复制模板",
      "可替换关键词",
      "图片视频生成",
      "kling",
      "image-to-video-action"
    ],
    "styleTags": [],
    "seoKeywords": [
      "视频",
      "可灵 Kling",
      "图片动作增强图生视频",
      "视频提示词",
      "可灵",
      "工具:可灵 Kling",
      "模态:视频",
      "用途:图片动作增强图生视频",
      "难度:入门",
      "官方结构参考:否"
    ]
  },
  "model": {
    "tool": "可灵 Kling",
    "name": "kling"
  },
  "variables": {
    "names": [
      "{首帧内容}",
      "{动作}",
      "{幅度}",
      "{镜头}",
      "{环境变化}",
      "{比例}",
      "{时长}",
      "{结尾}",
      "{输出格式}"
    ],
    "defaults": {
      "首帧内容": "待定",
      "动作": "从关闭到点亮，再切到使用细节",
      "幅度": "待定",
      "镜头": "缓慢推进",
      "环境变化": "待定",
      "比例": "9:16",
      "时长": "8 秒",
      "结尾": "待定",
      "输出格式": "待定"
    }
  },
  "provenance": {
    "source": "v2 5000 visual copy-ready templates / original platform-adapted library",
    "authorName": "",
    "authorUrl": "",
    "sourceUrl": "",
    "licenseType": "",
    "licenseConfirmed": false,
    "submissionIssueNumber": null,
    "rightsStatus": "pending"
  },
  "proof": null,
  "publication": {
    "status": "published",
    "featured": false,
    "copyReady": true,
    "qualityScore": 90,
    "qualityLevel": "quality-v3-ready",
    "verifiedAt": "2026-05-21",
    "collectionIds": [],
    "createdAt": "",
    "updatedAt": "",
    "publishedAt": "",
    "qualityAssessment": {
      "status": "passed",
      "rubricVersion": "prompt-quality-v3-structural",
      "score": 90,
      "checkedAt": "2026-07-18",
      "issues": []
    }
  }
}
