{
  "schemaVersion": 2,
  "id": "v2-video-kling-drink-pour-storyboard",
  "content": {
    "title": "可灵 Kling · 饮品倒入镜头 · 分镜版",
    "summary": "可灵 Kling 适用的「饮品倒入镜头」分镜版：通过液体倒入、气泡和水珠体现清爽感，包含复制即用正文、可替换关键词、平台参数、失败修正和安全边界。",
    "preview": "",
    "prompt": "请使用 可灵 Kling 生成一段「饮品倒入镜头」视频。主体是 {饮品}，发生在 {杯型}，核心动作围绕 {配料} 展开，镜头使用 {镜头} 或同等稳定运镜，画幅为 {比例}。拆成 3 到 5 个镜头，每个镜头只承担一个动作目标。 前 3 秒交代主体和目标，中段展示动作变化，结尾停在可作为封面的稳定画面。保持主体、服装、道具、产品外观、光线和空间方向一致；不要突然切换场景、不要身份漂移、不要生成随机文字。",
    "copyPrompt": "",
    "language": "zh-CN"
  },
  "classification": {
    "category": "视频提示词 / 可灵",
    "department": "",
    "scenario": "",
    "task": "",
    "modality": "视频",
    "useCase": "饮品倒入镜头",
    "aspectRatio": "{画面比例}",
    "difficulty": "中级",
    "tags": [
      "工具:可灵 Kling",
      "模态:视频",
      "用途:饮品倒入镜头",
      "难度:中级",
      "官方结构参考:否",
      "一键复制模板",
      "可替换关键词",
      "图片视频生成",
      "kling",
      "drink-pour"
    ],
    "styleTags": [],
    "seoKeywords": [
      "视频",
      "可灵 Kling",
      "饮品倒入镜头",
      "视频提示词",
      "可灵",
      "工具:可灵 Kling",
      "模态:视频",
      "用途:饮品倒入镜头",
      "难度:中级",
      "官方结构参考:否"
    ]
  },
  "model": {
    "tool": "可灵 Kling",
    "name": "kling"
  },
  "variables": {
    "names": [
      "{饮品}",
      "{杯型}",
      "{配料}",
      "{镜头}",
      "{光线}",
      "{比例}",
      "{动作速度}",
      "{背景}",
      "{时长}",
      "{输出格式}"
    ],
    "defaults": {
      "饮品": "待定",
      "杯型": "待定",
      "配料": "待定",
      "镜头": "缓慢推进",
      "光线": "暖色桌面灯与冷色环境对比",
      "比例": "9:16",
      "动作速度": "待定",
      "背景": "待定",
      "时长": "8 秒",
      "输出格式": "待定"
    }
  },
  "provenance": {
    "source": "v2 5000 visual copy-ready templates / original platform-adapted library",
    "authorName": "",
    "authorUrl": "",
    "sourceUrl": "",
    "licenseType": "",
    "licenseConfirmed": false,
    "submissionIssueNumber": null,
    "rightsStatus": "pending"
  },
  "proof": null,
  "publication": {
    "status": "published",
    "featured": false,
    "copyReady": true,
    "qualityScore": 100,
    "qualityLevel": "quality-v2-passed",
    "verifiedAt": "2026-05-21",
    "collectionIds": [],
    "createdAt": "",
    "updatedAt": "",
    "publishedAt": "",
    "qualityAssessment": {
      "status": "passed",
      "rubricVersion": "prompt-quality-v2",
      "score": 100,
      "checkedAt": "2026-07-12",
      "issues": []
    }
  }
}
