{
  "schemaVersion": 2,
  "id": "v2-image-ideogram-real-estate-campaign",
  "content": {
    "title": "Ideogram · 房产空间宣传图 · 投放广告版",
    "summary": "Ideogram 适用的「房产空间宣传图」投放广告版：生成户型或空间宣传视觉，强调采光、收纳和生活方式，包含复制即用正文、可替换关键词、平台参数、失败修正和安全边界。",
    "preview": "",
    "prompt": "请使用 Ideogram 生成一张「房产空间宣传图」图片。画面主体是 {空间类型}，使用场景为 {面积}，重点呈现 {风格}，整体风格、情绪和色彩氛围为 {目标客户}，采用 {画面比例} 构图。突出利益点、行动区和品牌安全边界，适合信息流广告。 构图需要有清晰视觉中心、前中后景层次、可见材质细节、可控光影和后期排版留白。文字只允许出现用户明确填写的短句，其他区域保持无文字。输出必须商业安全、原创、可直接用于图片生成。",
    "copyPrompt": "",
    "language": "zh-CN"
  },
  "classification": {
    "category": "图像提示词 / Ideogram",
    "department": "AI 视觉设计",
    "scenario": "Ideogram",
    "task": "房产空间宣传图",
    "modality": "图像",
    "useCase": "房产空间宣传图",
    "aspectRatio": "{画面比例}",
    "difficulty": "入门",
    "tags": [
      "工具:Ideogram",
      "模态:图像",
      "用途:房产空间宣传图",
      "难度:入门",
      "官方结构参考:否",
      "一键复制模板",
      "可替换关键词",
      "图片视频生成",
      "ideogram",
      "real-estate"
    ],
    "styleTags": [],
    "seoKeywords": [
      "图像",
      "Ideogram",
      "房产空间宣传图",
      "图像提示词",
      "工具:Ideogram",
      "模态:图像",
      "用途:房产空间宣传图",
      "难度:入门",
      "官方结构参考:否",
      "一键复制模板"
    ]
  },
  "model": {
    "tool": "Ideogram",
    "name": "ideogram"
  },
  "variables": {
    "names": [
      "{空间类型}",
      "{面积}",
      "{风格}",
      "{目标客户}",
      "{镜头}",
      "{画面比例}",
      "{窗景}",
      "{生活物件}",
      "{目标平台}",
      "{输出格式}"
    ],
    "defaults": {
      "空间类型": "待定",
      "面积": "待定",
      "风格": "待定",
      "目标客户": "待定",
      "镜头": "待定",
      "画面比例": "4:5",
      "窗景": "待定",
      "生活物件": "待定",
      "目标平台": "待定",
      "输出格式": "待定"
    }
  },
  "provenance": {
    "source": "v2 5000 visual copy-ready templates / original platform-adapted library",
    "authorName": "",
    "authorUrl": "",
    "sourceUrl": "",
    "licenseType": "",
    "licenseConfirmed": false,
    "submissionIssueNumber": null,
    "rightsStatus": "pending"
  },
  "proof": null,
  "publication": {
    "status": "published",
    "featured": false,
    "copyReady": true,
    "qualityScore": 100,
    "qualityLevel": "quality-v2-passed",
    "verifiedAt": "2026-05-21",
    "collectionIds": [],
    "createdAt": "",
    "updatedAt": "",
    "publishedAt": "",
    "qualityAssessment": {
      "status": "passed",
      "rubricVersion": "prompt-quality-v2",
      "score": 100,
      "checkedAt": "2026-07-12",
      "issues": []
    }
  }
}
