{
  "schemaVersion": 2,
  "id": "v2-video-jimeng-seedance-onboarding-steps-three-act",
  "content": {
    "title": "即梦 / Seedance · 新用户引导视频 · 三段式版",
    "summary": "即梦 / Seedance 适用的「新用户引导视频」三段式版：用屏幕和生活场景解释从注册到完成任务的过程，包含复制即用正文、可替换关键词、平台参数、失败修正和安全边界。",
    "preview": "",
    "prompt": "请使用 即梦 / Seedance 生成一段「新用户引导视频」视频。主体是 {产品}，发生在 {用户目标}，核心动作围绕 {步骤} 展开，镜头使用 {设备} 或同等稳定运镜，画幅为 {画面比例}。开头交代问题，中段展示变化，结尾形成可截图的稳定画面。 前 3 秒交代主体和目标，中段展示动作变化，结尾停在可作为封面的稳定画面。保持主体、服装、道具、产品外观、光线和空间方向一致；不要突然切换场景、不要身份漂移、不要生成随机文字。",
    "copyPrompt": "",
    "language": "zh-CN"
  },
  "classification": {
    "category": "视频提示词 / 即梦 Seedance",
    "department": "AI 视频创作",
    "scenario": "即梦 Seedance",
    "task": "新用户引导视频",
    "modality": "视频",
    "useCase": "新用户引导视频",
    "aspectRatio": "{画面比例}",
    "difficulty": "入门",
    "tags": [
      "工具:即梦 / Seedance",
      "模态:视频",
      "用途:新用户引导视频",
      "难度:入门",
      "官方结构参考:否",
      "一键复制模板",
      "可替换关键词",
      "图片视频生成",
      "jimeng-seedance",
      "onboarding-steps"
    ],
    "styleTags": [],
    "seoKeywords": [
      "视频",
      "即梦 / Seedance",
      "新用户引导视频",
      "视频提示词",
      "即梦",
      "Seedance",
      "工具:即梦 / Seedance",
      "模态:视频",
      "用途:新用户引导视频",
      "难度:入门"
    ]
  },
  "model": {
    "tool": "即梦 / Seedance",
    "name": "jimeng-seedance"
  },
  "variables": {
    "names": [
      "{产品}",
      "{用户目标}",
      "{步骤}",
      "{设备}",
      "{时长}",
      "{画面比例}",
      "{手势}",
      "{字幕}",
      "{输出格式}"
    ],
    "defaults": {
      "产品": "虚构智能桌面灯",
      "用户目标": "待定",
      "步骤": "待定",
      "设备": "待定",
      "时长": "8 秒",
      "画面比例": "9:16",
      "手势": "待定",
      "字幕": "待定",
      "输出格式": "待定"
    }
  },
  "provenance": {
    "source": "v2 5000 visual copy-ready templates / original platform-adapted library",
    "authorName": "",
    "authorUrl": "",
    "sourceUrl": "",
    "licenseType": "",
    "licenseConfirmed": false,
    "submissionIssueNumber": null,
    "rightsStatus": "pending"
  },
  "proof": null,
  "publication": {
    "status": "published",
    "featured": false,
    "copyReady": true,
    "qualityScore": 90,
    "qualityLevel": "quality-v3-ready",
    "verifiedAt": "2026-05-21",
    "collectionIds": [],
    "createdAt": "",
    "updatedAt": "",
    "publishedAt": "",
    "qualityAssessment": {
      "status": "passed",
      "rubricVersion": "prompt-quality-v3-structural",
      "score": 90,
      "checkedAt": "2026-07-18",
      "issues": []
    }
  }
}
