{
  "schemaVersion": 2,
  "id": "v2-video-luma-beauty-texture-motion-image-to-video",
  "content": {
    "title": "Luma Dream Machine · 美妆质地动态 · 图生视频版",
    "summary": "Luma Dream Machine 适用的「美妆质地动态」图生视频版：展示膏体、粉末、刷头、反光和轻微使用动作，包含复制即用正文、可替换关键词、平台参数、失败修正和安全边界。",
    "preview": "",
    "prompt": "请使用 Luma Dream Machine 生成一段「美妆质地动态」视频。主体是 {产品}，发生在 {质地}，核心动作围绕 {工具} 展开，镜头使用 {动作} 或同等稳定运镜，画幅为 {比例}。把首帧作为构图和主体依据，只描述运动和环境变化。 前 3 秒交代主体和目标，中段展示动作变化，结尾停在可作为封面的稳定画面。保持主体、服装、道具、产品外观、光线和空间方向一致；不要突然切换场景、不要身份漂移、不要生成随机文字。",
    "copyPrompt": "",
    "language": "zh-CN"
  },
  "classification": {
    "category": "视频提示词 / Luma",
    "department": "",
    "scenario": "",
    "task": "",
    "modality": "视频",
    "useCase": "美妆质地动态",
    "aspectRatio": "{画面比例}",
    "difficulty": "入门",
    "tags": [
      "工具:Luma Dream Machine",
      "模态:视频",
      "用途:美妆质地动态",
      "难度:入门",
      "官方结构参考:否",
      "一键复制模板",
      "可替换关键词",
      "图片视频生成",
      "luma",
      "beauty-texture-motion"
    ],
    "styleTags": [],
    "seoKeywords": [
      "视频",
      "Luma Dream Machine",
      "美妆质地动态",
      "视频提示词",
      "Luma",
      "工具:Luma Dream Machine",
      "模态:视频",
      "用途:美妆质地动态",
      "难度:入门",
      "官方结构参考:否"
    ]
  },
  "model": {
    "tool": "Luma Dream Machine",
    "name": "luma"
  },
  "variables": {
    "names": [
      "{产品}",
      "{质地}",
      "{工具}",
      "{动作}",
      "{镜头}",
      "{比例}",
      "{光线}",
      "{边界}",
      "{时长}",
      "{输出格式}"
    ],
    "defaults": {
      "产品": "虚构智能桌面灯",
      "质地": "待定",
      "工具": "待定",
      "动作": "从关闭到点亮，再切到使用细节",
      "镜头": "缓慢推进",
      "比例": "9:16",
      "光线": "暖色桌面灯与冷色环境对比",
      "边界": "待定",
      "时长": "8 秒",
      "输出格式": "待定"
    }
  },
  "provenance": {
    "source": "v2 5000 visual copy-ready templates / original platform-adapted library",
    "authorName": "",
    "authorUrl": "",
    "sourceUrl": "",
    "licenseType": "",
    "licenseConfirmed": false,
    "submissionIssueNumber": null,
    "rightsStatus": "pending"
  },
  "proof": null,
  "publication": {
    "status": "published",
    "featured": false,
    "copyReady": true,
    "qualityScore": 100,
    "qualityLevel": "quality-v2-passed",
    "verifiedAt": "2026-05-21",
    "collectionIds": [],
    "createdAt": "",
    "updatedAt": "",
    "publishedAt": "",
    "qualityAssessment": {
      "status": "passed",
      "rubricVersion": "prompt-quality-v2",
      "score": 100,
      "checkedAt": "2026-07-12",
      "issues": []
    }
  }
}
