{
  "schemaVersion": 2,
  "id": "v2-video-pixverse-video-fashion-accessory-motion-three-act",
  "content": {
    "title": "PixVerse Video · 配饰动态展示 · 三段式版",
    "summary": "PixVerse Video 适用的「配饰动态展示」三段式版：展示包袋、眼镜、首饰等配饰的佩戴和细节，包含复制即用正文、可替换关键词、平台参数、失败修正和安全边界。",
    "preview": "",
    "prompt": "请使用 PixVerse Video 生成一段「配饰动态展示」视频。主体是 {配饰}，发生在 {人物或手部}，核心动作围绕 {动作} 展开，镜头使用 {场景} 或同等稳定运镜，画幅为 {比例}。开头交代问题，中段展示变化，结尾形成可截图的稳定画面。 前 3 秒交代主体和目标，中段展示动作变化，结尾停在可作为封面的稳定画面。保持主体、服装、道具、产品外观、光线和空间方向一致；不要突然切换场景、不要身份漂移、不要生成随机文字。",
    "copyPrompt": "",
    "language": "zh-CN"
  },
  "classification": {
    "category": "视频提示词 / PixVerse",
    "department": "AI 视频创作",
    "scenario": "PixVerse",
    "task": "配饰动态展示",
    "modality": "视频",
    "useCase": "配饰动态展示",
    "aspectRatio": "{画面比例}",
    "difficulty": "中级",
    "tags": [
      "工具:PixVerse Video",
      "模态:视频",
      "用途:配饰动态展示",
      "难度:中级",
      "官方结构参考:否",
      "一键复制模板",
      "可替换关键词",
      "图片视频生成",
      "pixverse-video",
      "fashion-accessory-motion"
    ],
    "styleTags": [],
    "seoKeywords": [
      "视频",
      "PixVerse Video",
      "配饰动态展示",
      "视频提示词",
      "PixVerse",
      "工具:PixVerse Video",
      "模态:视频",
      "用途:配饰动态展示",
      "难度:中级",
      "官方结构参考:否"
    ]
  },
  "model": {
    "tool": "PixVerse Video",
    "name": "pixverse-video"
  },
  "variables": {
    "names": [
      "{配饰}",
      "{人物或手部}",
      "{动作}",
      "{场景}",
      "{镜头}",
      "{比例}",
      "{光线}",
      "{结尾}",
      "{时长}",
      "{输出格式}"
    ],
    "defaults": {
      "配饰": "待定",
      "人物或手部": "待定",
      "动作": "从关闭到点亮，再切到使用细节",
      "场景": "夜晚书桌",
      "镜头": "缓慢推进",
      "比例": "9:16",
      "光线": "暖色桌面灯与冷色环境对比",
      "结尾": "待定",
      "时长": "8 秒",
      "输出格式": "待定"
    }
  },
  "provenance": {
    "source": "v2 5000 visual copy-ready templates / original platform-adapted library",
    "authorName": "",
    "authorUrl": "",
    "sourceUrl": "",
    "licenseType": "",
    "licenseConfirmed": false,
    "submissionIssueNumber": null,
    "rightsStatus": "pending"
  },
  "proof": null,
  "publication": {
    "status": "published",
    "featured": false,
    "copyReady": true,
    "qualityScore": 92,
    "qualityLevel": "quality-v3-ready",
    "verifiedAt": "2026-05-21",
    "collectionIds": [],
    "createdAt": "",
    "updatedAt": "",
    "publishedAt": "",
    "qualityAssessment": {
      "status": "passed",
      "rubricVersion": "prompt-quality-v3-structural",
      "score": 92,
      "checkedAt": "2026-07-18",
      "issues": []
    }
  }
}
